user,replying_to,comment,timestamp
hotandcoldt,1DMod,"I literally still can not comprehend Liam's death💔 I can't believe he's really gone. Forever 😭

I was unable to shed a tear when I first heard the news because I still couldn't process it at the time. It has since sunk in, and I can't stop bawling my eyes out. No one in my family loved 1D as much I did, and still do, so no one really understands my feelings about his death. As a former Liam girl, I was so violently in love with him for the majority of my childhood, but sort of stopped listening to him when the band split up, well to most of them except Niall. I did listen to most of Liam's music right after the band went on hiatus but that didn't go on for long because i just missed the boys' music together so it didn't feel right to me. I feel so devastated. I wish I could have supported and loved him a lot more while he was still alive. The illusion of time, I guess.

During the times I'm not sobbing since it sunk in that he's really gone, I find comfort in the thought that he couldn't have intentionally caused his own death, I keep thinking it has to have been an accident. It still hurts a lot, but thinking that he couldn't have chosen to go out like that calms the pain in my heart a little. I don't know when this ache in my chest will subside, but I'll say a prayer for him every day till it does, and one more for his son when it finally does. It's such a tragic, devastating loss. I'm so sorry we couldn't save you, sweet darling 💔😭😭😭Rest easy, my love, I hope you find some peace wherever you are now🕊💔🥹😭",2024-10-18 17:03:30
Outrageous_Spare6422,1DMod,"Liam's death still feels like a bad dream, it feels unreal. And apart from directioners no one understands the grief. I have been crying for the last 3 days and still can't cope up with the fact that the person who shaped our childhood and teenage years is no more. I can't imagine the pain and grief his family, his sisters, his brothers and his son are going through. 
After reading all the tributes I just can't help but feel for each and everyone of them. They've lost a son, a father, a brother and a boyfriend. A loss that can never be measured. I just hope they are taking care of themselves in their difficult time.
To all the directioners, I know how you feel and I'm hear if you want to talk.",2024-10-18 17:03:30
ap795,1DMod,"I wasn’t even a “huge” directioner but I feel deeply traumatised by this death? Like I keep thinking of it, waking up and instantly thinking of it, obsessed with looking it up online, I haven’t felt happiness since I heard? Is this normal? It’s just the most horrific thing and circumstances and I can’t shake it",2024-10-18 17:03:30
shewantsthe_dpt,1DMod,"An open letter to Liam Payne:

thank you. You were such a big part of my formative years and you really helped change me into who I am today. Your music touched me and helped me through some of the worst times in my life. And I know millions of others who were teenage girls at the time would say the same. In 2011 when I hear What Makes You Beautiful on the radio I just thought let me look them up to find out who this boyband is. And the rest is history. I got to see you have the time of your life performing with your brothers. And it changed my life just like it did yours. One Direction got me through my teenage and college years and I'll always be thankful to all 5. And although you did some things I don't support, you didn't deserve this. No one does but especially not someone who was as sweet as you. I wished One Direction would make the headlines again but never like this. You'll forever be 1/5 of One Direction. Rest peacefully Liam, thank you for being a part of my life.",2024-10-18 17:03:30
coraline_button_,1DMod,"I just need a place to vent and this seems like the best place. I have never been good with the idea of death. Whenever I thought of it, I would get shortness of breath and my eyes would feel prickly. I haven’t experienced someone passing who I was close with since 2013. Sure, I’ve been to funerals and have cried for people I barely knew, but I’m so unwell right now. 

My Grandma passed away 6 days prior to Liam passing away. She had Alzheimer’s, so I felt like I was a little prepared. Liam was SO unexpected. 

I was a One Direction girl ever since I found them in 2010/2011. They are STILL the only music I listen to (also their solo albums). 

I feel like the combination of both losses are making life extremely hard right now. I feel like I am genuinely depressed right now. Sometimes I can’t breathe. I can burst into tears at any second. I just feel like I have to hold it in all day until I can get into the shower and cry in private. 

I feel like my husband doesn’t understand, and I am so embarrassed and just try to act like I am not horribly sad. Feels like it’s just easier to be in a shower or sleeping. 

I have to travel this upcoming week for my grandma’s funeral and I am frankly I’m not sure how to function leading up to it. 

I am not at a risk of hurting myself at all. I just feel so utterly depressed.",2024-10-18 17:03:30
Chessa_Tomlinson,1DMod,"Diana 

For me the song Diana ties a lot into how i feel right now, how i connect to Liam and his passing. I know a lot of people are connecting with Night Changes and Story of my Life. The lyrics just connect so much right now with the entire situation, his struggle, how he saved the fans, and the media aspect. What songs are you connecting to right now a lot?",2024-10-18 17:03:30
Your-mom-07,1DMod,"Idk what to do ig I just need to vent.
I’m 17 l’ve been listening to one direction since I can remember my obsession kinda calmed down for a while until 2021-2022 | was obsessed w them all over again i listened to all their solo stuff all their 1D stuff they were my everything it kinda slowed down again the past year ish but i still love them so much. I don’t know what to do or how to feel about Liam. I feel so bad I laughed at stupid TTs making fun of him this past week and I was really sad and mad at him about everything that came out about him not being the greatest guy but all he needed was help and he didn’t get it. I’ve been crying so much since I found out I feel numb and sad and confused and mad at myself (as I should) | feel like I’ll never feel ok again ik that sounds dramatic but it’s truly how l feel I kinda wanna not be here anymore so l stop feeling this.
Anyway if you read this thank you",2024-10-18 17:03:30
newday2001,1DMod,"https://preview.redd.it/5n3ycu3trtvd1.jpeg?width=750&format=pjpg&auto=webp&s=ad4a984dab0606d2b3442dacf77abd9ba32d96d8

Photo from the memorial in NYC. It’s very moving to see the fans come together to pay tribute to his life so beautifully.",2024-10-18 17:03:30
FinancialEducator765,1DMod,"Hi everyone, I made a Reddit account just to say this. To everyone who is wanting to go at a memorial they can check out [HSNEWS](https://x.com/hs_news_?s=21) on TWT. The account has all the places that memorials are being held globally. Anyway, I’m heading out to the one in Vancouver tomorrow. Love you all.",2024-10-18 17:03:30
No-agency519,1DMod,"I haven't thought about 1D or any of it's members since roughly 2017, this loss of liam hit hard for me, he was my favorite member of 1D and so i went down memory lane for a bit to reflect. That was a happier time in my life and I wish his wasn't gone. Love all of you going through this, and I hope his family is doing okay through this awful time. Love you all and rest peacefully Liam, we'll miss you.",2024-10-18 17:03:30
julittle1,1DMod,Hey! Is there a megathread with celebrity tributes?,2024-10-18 17:03:30
Darthpwner,1DMod,"I got to see Liam in concert at Jingle Ball in 2017, and I will forever cherish that moment.

RIP Liam ❤️",2024-10-18 17:03:30
Exciting-Composer157,1DMod,"A Cross Stitch entry in the craft section of this weeks  Royal Geelong Show (Geelong, Australia)….  ❤️

https://preview.redd.it/g9mhpcxv9uvd1.jpeg?width=4032&format=pjpg&auto=webp&s=6f94fd479a23a4619df37e0b3d4aff6bdfca33ad",2024-10-18 17:03:30
hahaiqareadit,EternalOverthinker,Sending warm hugs to you. I hope your heart heals from this pain.,2024-10-18 17:03:30
Fuccmycwoochi,somyoshino,i needed this thank you,2024-10-18 17:03:30
CandidBandicoot4372,somyoshino,"thank you for bringing this up,i never experienced dv but i felt bad for feeling bad about his death after all the stuff came out",2024-10-18 17:03:30
Acrobatic-Phase-7696,Plenty_Bar7439,"Legit. It’s stupid of them to have done this. I would’ve rather he trashed everywhere than lose his life. He would’ve had to pay for it with money, not his life. I’m so upset.",2024-10-18 17:03:30
Shadynatsy,genius1soum,"I’ve been looking for one near Toronto :( I haven’t seen any Canadian ones so far, we’re in this together ❤️",2024-10-18 17:03:30
hpluvr934,genius1soum,"If you find any Vancouver ones, please let me know 💜
I'll be watching this is us this weekend, and reminiscing and honouring what Liam meant to me.

I wonder of we could get the Rio to do a screening of this is us as a memorial...",2024-10-18 17:03:30
Nervous_Ad_4586,genius1soum,"I would also be down if there’s anything happening in Vancouver, I really need to mourn with some people who understand!",2024-10-18 17:03:30
FinancialEducator765,genius1soum,"Hey love, just wanted to let you know that there’s one in Vancouver tomorrow

https://preview.redd.it/f443cn2axtvd1.jpeg?width=1277&format=pjpg&auto=webp&s=f80c225f24b2bbef5d592f7d8944d20f23d43051",2024-10-18 17:03:30
paruparong_coder,ZakariusMMA,Hugs for you as well. I hope you can win your fight!,2024-10-18 17:03:30
Alternative_Device68,cheesewwhiz,I haven’t been on twitter in a long time. I logged in today and immediately saw a pic of Liam’s body. I reported it. Very upsetting. I reported the pictures and will be deleting twitter. There is no reason why those pictures should be on there.,2024-10-18 17:03:30
ap795,Azyall,What the hell that’s so insensitive,2024-10-18 17:03:30
FinancialEducator765,gia_s_,"Check out HS news on twitter, they have all the memorials globally listed.",2024-10-18 17:03:30
paruparong_coder,coraline_button_,"Hugs for you...Just cry whenever you want, it's normal and it's okay. I hope it'll get better soon for you.",2024-10-18 17:03:30
1DMod,julittle1,"No, they basically all just have their own post. I haven’t collected them all into one post",2024-10-18 17:03:30
Plenty_Bar7439,Acrobatic-Phase-7696,just seen reports that a hotel staff was the one who supplied the drugs too(People's magazine),2024-10-18 17:03:30
odilaza,Shadynatsy,"The Toronto one has been announced I saw somewhere on reddit!

I’d be down to attend one in Vancouver ♥️",2024-10-18 17:03:30
every1isalreadytaken,Shadynatsy,There's a vigil in Toronto tomorrow. [Here](https://x.com/ppurplefairy/status/1847313617751867708)'s the twitter link,2024-10-18 17:03:30
wee1kinase,Shadynatsy,Is it only this sunday? I feel so disconnected from the community rn and idk if i can make it,2024-10-18 17:03:30
genius1soum,hpluvr934,Are you near Vancouver too? I'm trying to find but I don't see one. I edited my comment if you wanna read it. I think we should form a group and organise one ourselves.,2024-10-18 17:03:30
genius1soum,hpluvr934,"Hey I finally found this. 20th October, Sunday, 2 PM at Vancouver Art Gallery. Join this group if link is allowed here: https://www.facebook.com/share/g/t3HL9k5ExgdH1nBD/?mibextid=lOuIew",2024-10-18 17:03:30
genius1soum,FinancialEducator765,Yessss I'll be going to it tomorrow!,2024-10-18 17:03:30
genius1soum,odilaza,"Hey I finally found this. 20th October, Sunday, 2 PM at Vancouver Art Gallery. Join this group if link is allowed here: https://www.facebook.com/share/g/t3HL9k5ExgdH1nBD/?mibextid=lOuIew",2024-10-18 17:03:30
