user,replying_to,comment,timestamp
o_portista,1DMod,"Time flies, It's been over a day now with Liams Passing, and it's still as unbelievable as when it was still announced. Who would of thought we'd see a One Direction member passing so early, espically in our 20s.

Regardless, if you weren't a fan of One Direction, one way or another, if you were alive during their prime era you couldn't avoid them, and had to admit they were a phenomenal, and for a majority of us, it feels as if a piece of our childhoods went with him. I'm a guy, and I remember when I would go out with friends, their music would be all over the radio, TVs, and everyone had a positive view, even guys, who at the time, was sorta embarrassing to be a fan of theirs in public, and I can't think of anyone, or anything as popular, or had such a unique influence like they did during that era.

For some they are only finding about them now because of his passing, but I can't be the only one that truly wishes we could go back to those days, and nothing in today, can ever be as close as those times.

Liam obviously had issues, and One Direction alongside espically behind the scenes, and no matter what, we can all agree Liam deserved better, and needed help, and it's always when it's late we value these things, and how short life is, and his death, truly opened the eyes to many. One Direction to some at the time could of been a fad, but to many only now they realize, how it wasn't, and how much they truly valued those times. Despite the band ending years ago, yesterday, was the real ending, and it'll never truly be the same, an end of an era.

Wishing nothing but peace to Liam's friends, family at this time, and us fans who took it too heart deeply.

Originally was going to post it as my own post in the subreddit, but was told to post it here instead, truly great. 

https://preview.redd.it/w2rva928okvd1.png?width=640&format=png&auto=webp&s=6e44b2f743639cb04b75b4cacbd045a110608a9c",2024-10-18 17:03:30
EternalOverthinker,1DMod,"Originally was a post but thought I would share here

https://preview.redd.it/72jkj6b4kkvd1.jpeg?width=1290&format=pjpg&auto=webp&s=05eabf574f7463f2ebad74093166dc5122b3499c

Stumbled across something today

Liam was always so active with Directioners and had done multiple following sprees way back when. I remember SCREAMING my head off when I saw that he had followed me. It was during a very tough time in my life and was one of the few moments where I felt genuinely happy. I would often DM him when I needed someone to turn to throughout the years. While I never got a reply back, it always made me feel like someone was out there who cared. I’m in my late 20’s now and have really been struggling with the recent news. But I’ll always cherish this little connection we had 💔",2024-10-18 17:03:30
somyoshino,1DMod,"I originally made this as a post, but here it is as a comment to lighten the mods’ burden.

To my fellow survivors:

You are not an abuse apologist.

If you are expressing your love for the Liam you once knew and wishing he has peace, it does not make you a bad person.

Regardless of what anyone says, even if you express kindness and compassion for someone who did terrible things, you are a real victim and your feelings, whether they are anger or sorrow or happiness, are yours and they are true.

I don't know if this post will be taken down and am trying to avoid using language that may be triggering, but I need you to know this.

I am both a DV survivor who experienced some of the same things as his victims and former Liam girl who had the privilege to work with his team many years ago, and my feelings are endlessly complex and not helped by the insistence some people have that if you are a survivor the only feelings you should have about him are negative and you should only focus on his victims.

We were all there to know that he was once a good person who did and still does good things. We know that he was not born evil. Of course we wish to remember him that way. Of course his bandmates want to remember him that way.

You are a human being, and you are not like the people who hurt and doubted you when you came forward just because you still have love and hope in your heart. You are not making things worse for other survivors. I promise you that. 

I have all the love in the world for you and wish you the peace you deserve. ",2024-10-18 17:03:30
dagummiie,1DMod,"The last few days have been nothing short of an odd, emotional blur trying to process that Liam is gone. I feel like I'm on the same boat as most of you where 1D once consumed my life in my teenage years--they brought me purpose and community, and they were my reason to look forward to the next day during that period of my life. They made such an impact on so many of us, and though I admittedly did not keep up much since the split, I never stopped wishing the best for them. I only thought fondly of those years. I fully expected they would grow old with us, and maybe we would eventually get to see a 1D reunion take place.

I've been spending a lot of time reading through everyone's thoughts here--I once again feel this nostalgic need for an online community and safe space, just like we had all those years ago. But also, I've been surprised with how much this has been popping up in parts of my life I just didn't expect: People talking about it at work, also openly mourning, and hearing neighbors at my apartment playing Liam's songs in their car as they drive by. Also, having family or friends reach out because they remember how much I loved 1D (thinking about how their first thought of the news was to reach out to me feels so odd, but also I get it). 

It all makes me feel mixed emotions: proud at the reminder of Liam's impact, but also sad and frustrated that it took a tragedy for all the love to come out when it could have been communicated when he was still here. But I know that's just how life works. Even I was far disconnected with the fandom and their lives until this happened. I feel like we can only use this as a reminder to reach out to our loved ones often, including distant friends whom we've been meaning to talk to for some time.",2024-10-18 17:03:30
Plenty_Bar7439,1DMod,"Anyone annoyed by the fact that Liam was ""convulsing"" according to an eyewitness yet hotel staff kept taking him back to his room knowing that there is a balcony? Then calls the police/medic to say they are worried about him jumping! Like WTH if you were worried then take him to a medical room or keep him in the lobby till paramedics get there. This death could have been so easily avoided. I also wish I knew which email he read before he had his episode because that may have triggered him as the final nail in his coffin...",2024-10-18 17:03:30
genius1soum,1DMod,"Please is there a gathering or vigil happening in Vancouver? I need to connect with you all. It's tough going it alone.

Edit: I'm editing my comment to add more context.

I'm taking it extremely hard. As a boy directioner, they were like brothers to me. No one in my circle would understand. I'm unable to grief. Just locked myself in my room. But I have to go for work. I come back to my room and burst in tears.

We can't go his funeral to find peace in mourning but can we do a Vancouver gathering and vigil?",2024-10-18 17:03:30
stewieswaffles,1DMod,"Mourning Liam: A Reflection

I’ve been mourning. Two long, hard days have passed and I am deeply sad in ways that I can’t seem to justify nor fix. 

I’ve been remembering. We all have our reasons and attachments that come with the love of this band. For me, my memories of One Direction are the happiest days of my extremely difficult girlhood amidst divorce and school bullying. But One Direction—my enthusiasm for their videos and personalities, and the time I spent with friends watching the movie and gushing about our favorites—that is what kept me just the slightest bit present and engaged in the world. 

My dream was and always will be to meet them, tell them what it is that they have done for me. At the very least, I was itching to see them in concert. But, I was too young and too broke. I never got to see One Direction in person or give them my best wishes. Some part of me was hoping that someday a reunion would come, and my presence in a cheering stadium would tell each member how much I cherished them and how much they impacted my small world. For days I’ve been mourning that this dream and hope can never be fully realized. My favorite member, Liam, would never know that he and his bandmates saved my life in many ways. 


But in my reflection I have also realized that perhaps now, more than ever, Liam can see the fans that maybe he didn’t even know he had. Zayn said in his message, “I have found myself talking out loud to you, hoping you could hear me.” This has been the comforting reminder that I didn’t realize I needed. My challenge and permission to myself (and to you if you need it): tell him—cry to and about him. 

I don’t know what that looks like for you—maybe writing a letter, singing his songs, just talking to him to share your appreciation, and memories. Somewhere, in whatever comes after this life, Liam has all the time in the world to see each of us, to hear each of us, to know that he is loved. Our grief can bring all of us, including Liam, the healing we need.

It is a precious gift to remember someone. They may not be here face to face but they will always be in your soul bringing you joy, and happiness, and everything else they made you feel. Our precious and happy memories remind us that our feelings are valid, our relationships (yes, even the parasocial ones) are sacred, and that we are not as alone as we feel. 

—

To Liam: if you’re reading this, I want to say I will always be a Liam girl and I am still grateful for all the ways your work and music has brought joy to my life. Though I wasn’t always a fan of your  actions, you deserved so much better than the messes, the mental health issues, and bad days that life gave you. I hope that wherever you are now, you can begin to feel at peace and heal years of trauma. I am so extremely grateful for all that you and this band did to make Directioners worldwide feel seen and heard. 🤍",2024-10-18 17:03:30
Smooth-Science4983,1DMod,i’m confused and grieving in a way but truly don’t have anyone who relates in my personal life to lean on. Just posting this in hopes it gets it off my chest and others who feel the same know they aren’t alone,2024-10-18 17:03:30
No_Elk9976,1DMod,"I can’t post bc of my low karma :( But this was originally my post…

I was listening to walking in the wind for what seems like the billionth time and this time instead of the chorus it was this part that broke my heart so much:

“The fact that we can sit right here and say goodbye means that we’ve already won”.

His parents, his family, his son, Louis, Zayn, Niall, Harry, and all of us… No one got to say goodbye to you Liam. But I am still so very grateful for the good times 🤍❤️I hope he can feel how much we all really love him, I’m just so sorry he isn’t here to see it.

https://preview.redd.it/krubr4kfvmvd1.jpeg?width=4032&format=pjpg&auto=webp&s=9c0446d9db01d867890ed3ace36886db5cce7236",2024-10-18 17:03:30
Luna2559,1DMod,"Guys i just noticed this..... Im assuming he made himself to be the guy in the middle. every other member has a reflection but the guy in the middle doesnt...and since hes literally in the middle, i doubt you can ""forget"" to give a mirror effect to everyone but him...was this a sign?



https://preview.redd.it/7w9uql03cnvd1.png?width=553&format=png&auto=webp&s=1fda47ca39f6900c5bd4229b2285d097a3e5e34b",2024-10-18 17:03:30
ZakariusMMA,1DMod,"Big wrestling fan here, also a Brit born in 05. 

I'm really torn about this one. Was never a fan of 1D, back when I was younger it was uncool to be a boy who liked them. Always found myself humming or singing them alone (I'm 100% straight), I remember the reason I liked Liam the most. His bucket list had ""hug a WWE champion"" on it. His personality is really like mine. Jealous, and needing something.

As someone going through substance abuse right now, knowing the struggles of it, this one hurts. Hope I'm not next but hope you're good up there Liam. Heart is out there for you.",2024-10-18 17:03:30
cheesewwhiz,1DMod,"Is anyone else avoiding twitter as of today?

I am taking a break from twitter because I keep seeing all these posts about people saying to report multiple accounts that are sharing uncensored pictures of Liam after his fall. I am genuinely scared to accidentally come across the picture. I want to remember Liam as we knew him, not like that. It is absolutely sickening that people are sharing the picture. I hope to God none of his family or friends see it or even any of us. People reporting the accounts on Twitter have said they are absolutely traumatized now. I was finding Twitter as a place of comfort to share my grief with other directioners and now I am terrified to go on there at the moment💔",2024-10-18 17:03:30
cheet0h0e,1DMod,"i’ve always had this thought that maybe the reunion we were all waiting for would be in a wedding of one of the lads, not in a wake. i’ve already given up the thought of an ot5 reunion stage, thinking that it was too much to ask. “they’re already so successful in their own careers why would they still want to get back together” that’s what i kept telling myself.

but somehow, a part of me was still holding on to their promise of coming back, or maybe even just a closure since we never had a proper goodbye. we all just moved on with our lives but, unknowingly, we all left a little fold in one direction’s chapter. it was a page we could all easily go back to in an instant.

sending my love to everyone. we’ll get through this :)",2024-10-18 17:03:30
Azyall,1DMod,"I don't know where or if I should post this, so mods please delete if it is inappropriate.

I'm calling for British fans to complain to the BBC for going ahead with Friday's broadcast of the comedy show ""The Cleaner"" on BBC One, which, not to put too fine a point on it, showed a man falling to his death from a balcony not just once but multiple times in the 30 minute episode called ""The Committee"".

If you, like me, think this was grossly insensitive given the events of this week, and the BBC's own extensive coverage from Argentina on the news, you can register a complaint using the form [HERE](https://www.bbc.co.uk/contact/complaints/make-a-complaint/#/Complaint).

Thank you for your time.",2024-10-18 17:03:30
Firm_Somewhere_8599,1DMod,"1D was all that I've listened to when I was five. Suddenly, grief hit me like a freight truck when my dad told me about Liam's passing two whole days later. I thought it was a hoax, but everyone's saying it, and it's everywhere. Devastated. Just devastated. I've missed so much 1D stuff for the past 8 years.

1D truly was phenomenonal and had a huge cultural impact. They were such a big part in the lives of probably mostly Gen Zs and early Gen Alphas who grew up in the mid 10s.

Liam, we all love you and cannot be more grateful that you were a part of so many of our lives. It hurts to know that you were only 31 and that your son, Bear, is only seven. We'll always love you and will cherish you. Thank you, condolences to your family and friends. Rest in peace 💔💔",2024-10-18 17:03:30
gia_s_,1DMod,"Hello! does anyone have info on any memorials in eastern Washington or northern Idaho? Thank you so much, rest in peace Liam 💔💔",2024-10-18 17:03:30
profsmoke,1DMod,RIP Liam Payne 🙏,2024-10-18 17:03:30
CandidBandicoot4372,1DMod,[https://www.tiktok.com/t/ZP88yHfaK/](https://www.tiktok.com/t/ZP88yHfaK/),2024-10-18 17:03:30
Known-Amoeba6370,1DMod,"**My Thoughts on Liam's Passing**

In all honesty his death doesn't come to a shock for me. The way Liam lived was self-destructive and a cry for help. It's a tragedy. Watching back over everything it made me come to a little bit of an understanding of what was going on in his life. I always felt out of everyone in the band Liam was the most lost to me. They all had distinct personalities that set them apart, but Liam felt like he never truly had an identity. It was clear to see in the beginning of the band that Liam was ""supposed"" to be the leader. He had an amazing voice he had the textbook definition of ""perfect boy band look"" and everything. I felt like he had a lot of pressure put on him to be this person he wasn't. You could tell he was quite shy when he was young but then he turned into someone who was the complete opposite. I think this probably took a toll on him which made him into the person he became. It's hard to hear everyone tell you that you should be this way or that. I think it made him spiral into this identity crisis we saw after the band went on hiatus. While all the other members had their own successes and kind of became their own person away from one direction, I feel as if though Liam's identity was only One Direction. This past couple years we definitely saw this identity crisis come to the surface. The podcast he went on was a major red flag, and the hate he got afterwards made things worse. He became a cringe meme on TikTok for his song Strip That Down. It was sad watching him breakdown in real life. After the meme died down a little I was hopeful he was figuring himself out, He had a girlfriend, he was traveling, he seemed happy he was reconnecting back with the boys again, but then the accusations came by his ex-fiancé (ex-girlfriend?) about him being an abuser. I don't know the full story yet but it was devastating to hear. And now he's dead. I don't think it was a suicide, I think he genuinely fell, but the drugs and the alcohol mixed together probably made him disoriented. It's nobodies fault that he died. I think this is just one of those unfortunate accidents and somebodies downfall. I hate that this is how his story ended, I wish he could be there for his son, who now lost a father. I feel that he could've changed and found himself if given the time. But we will never know :(",2024-10-18 17:03:30
Ok-Meeting-88,1DMod,"**My reflection and metaphor for this tragedy**

**This book was fresh in my mind having read it again recently**

How Orwell’s 1984 Sheds Light on the Exploitation of Liam Payne

His recent struggles in the music industry bear a striking resemblance to the dystopian themes in Orwell’s 1984. Fame, once a dream, has turned into something far more sinister, with Payne’s experience revealing how artists can become expendable in a profit-driven system.

Fans and critics often brush off celebrity issues with “What do they have to complain about?” But that mindset misses the deeper point. Much like Orwell’s totalitarian regime, the music industry is designed to keep control. It uses and discards people for profit, leaving them behind when they’re no longer useful.

In 1984, the individual is crushed for the sake of maintaining power. The same happens in music: Liam Payne, like many artists, was pushed to his limits by those profiting from him, only to be cast aside once his relevance faded. The moment he spoke out about his struggles, the industry cut him loose—just like Orwell’s regime casts out those who threaten the status quo.

Even more tragic is the role of fans. In this analogy, they are Orwell’s ‘proles’—unknowingly sustaining the system. The merchandise keeps selling, the singles keep streaming, and the industry keeps going, indifferent to the damage it causes.

Payne’s journey mirrors Winston Smith’s in 1984. He tried to push back, but found that the system is bigger than him. His experience highlights how fame can become its own Orwellian nightmare, one where profit and control are all that matter.

It’s easy to dismiss celebrities and have this idealistic picture of their life, but Payne’s story is a reminder that the machinery of fame can be destructive—and we, as fans, are often complicit in its survival.

Just my own thoughts. He deserved better than this end.

God rest your soul lad, The pain is gone and your at peace.

Take it easy folks",2024-10-18 17:03:30
Frequent_Earth2135,1DMod,"I never considered myself a fan. I listened to the first album, and the second one front to back with my sister. That's it really. I did like Liam though. I think I felt myself in him, which would only be crystallised when I watched an interview with him many years later. I moved on though. When this happened I found myself scouring for details, and losing my composure. Just a little. But when I was coming home for work, relistening to the old podcast episode I listened to way back he mentioned their last album. So, I turned it on and broke down crying at 'If I could fly'. I pulled into Woolworths and cried so much. I still don't understand my feelings, but I'm clearly upset by this. I had my own substance issues, and suicide attempts, so I can only imagine it hurts seeing someone who I could relate to go. I wish I could speak with more clarity but my feelings are something I'm seeking help to better express. I'm just really upset. They were playing a 1D song at the supermarket today. I felt a jolt to my chest, shallowed breathing and a wave of feelings brimming. I'm just a little all over the place and I wanted to speak about that somewhere.",2024-10-18 17:03:30
MarmiteX1,1DMod,"I wasn't into their music, I knew like 2 of their songs but I know how popular they were due to exposure of One Direction on TV shows, radio, Billboards etc.  
I like how he was into pro-wrestling. It's sad news regardless what transpired. Someone's brother, son, friend, cousin etc has gone. RIP Liam!",2024-10-18 17:03:30
serendipia2002,1DMod,"Guys what are the latest updates on Liam's passing so far? Everyone is saying sth different, we don't know what is true and what is a rumor or misinformation.

Some are saying he went through substance abuse long ago, or had mental health issues, others say it was staged/conspiracy, or his gf cheated on him, others r saying it's bc the last video Maya made, etc. 

I, like all of you, just want to know the truth. Is there anything I might be missing out on? Or we should just be waiting for an official police statement? Please tell me 🙏🏻

RIP my dear Liam, I love you 💔",2024-10-18 17:03:30
EnduringMelancholia,1DMod,"I just want to offer my condolences to Liam’s friends and family and to the entire One Direction community. 

I am incredibly sorry for your loss. 

He will be dearly and sincerely missed. 

My heart goes out to all of you. 

♥️",2024-10-18 17:03:30
Tkelly1173,1DMod,Are there any memorials that will be taking place in CT?? Can’t seem to find any listed,2024-10-18 17:03:30
gotpma21,1DMod,"Anyone who’d like to do a Vigil in East Anglia?🕯️

Hey everyone, as all of you I am too having a really hard time rn. I am 26 y/o and never would have thought Liams death would hit me quite as much as it did, but I guess I just never considered one of them dying so young. I have been a fan since early 2012 and after 2016 I‘ve been revisiting the fandom every once in a while. The days/ weeks bevor Liams passing I happened to have a really intense 1D phase as I just moved places and basically began to start from scratch in a new town (just moved back to the UK from Germany). The boys and the fandom were always such a comforting space but just having rewatched all their video diaries/ auditions/ etc the days before Liams eventual passing just made it such a traumatizing experience (as for many of you Im sure).
And having no one around safe for my co-workers who’ve known me for a hot minute now, doesn’t really help the situation either… I would really like to attend a vigil but have to work this weekend unfortunately, so I was wondering if maybe anyone in the Suffolk area has similar issues and might want to do a vigil in the east of England? Like in Ipswich/ Colchester or Norwich? Or just meet and have a chat about everything going on rn? 🫶",2024-10-18 17:03:30
Pure_Category_4207,1DMod,"

The truth is, I’m scared. I’m scared, Liam.

You didn’t know me, but I loved you. With every ounce of my soul, all I felt was love for you.

Thirteen-year-old me sat on the stairs at that Christian school, listening to you. Every morning, I’d wake up, grab my earbuds, and play your songs while I got ready for school.

I remember being afraid to let people know how much I loved the band. I was scared they’d make fun of me, and I was already alone at school every day. I didn’t need more of that. But it was okay because I had you, and in some strange way, it felt like you had me too.

You saved me when I had nothing and no one. I grew up with you. I was a kid, then a teenager, and now I’m an adult. As time passed, I stopped grabbing my earbuds as often. I changed. But every once in a while, on my way to work, I’d go back to my old playlist and find you again. Your voice felt like home. You were always there for me. I always had you.

But I’m scared, Liam. Because now that you’re gone, I’ve realized just how fragile life is. I took it for granted. I took you for granted. I never stopped to think that one day, you might not be there to fall back on. The thought that you were fighting your own battles while you were saving people like me… it hurts. It’s terrifying.

I know I was just one person, and you had millions of fans. Billions of people who loved you. But… I wish I could’ve saved you like you saved me. I wish I could’ve given you the same hope and strength you gave me when I was lost.",2024-10-18 17:03:30
